{
  "matrix_schema_version": "2.0.0",
  "matrix_id": "governed-research-workflow-v1-support-scope-matrix",
  "matrix_status": "interface_frozen",
  "package_contract": {
    "source_version": "v1.0.0",
    "historical_public_baseline": "v0.13.0",
    "public_profiles": ["standalone", "framework_integrated"],
    "release_identity_rule": "A selected public version is available only when its exact annotated tag and matching GitHub Release resolve to the selected source commit. This matrix is not a hosted Release or installed-runtime claim."
  },
  "authority_boundary": {
    "module_support_owner": "This matrix is the sole machine-readable authority for module-level V1 support posture.",
    "capability_claim_owner": "capability_truth_ledger.json remains the sole machine-readable authority for individual capability promise, non-promise, evidence, and admission fields.",
    "release_identity_owner": "An exact annotated Git tag and matching GitHub Release establish selected public-release identity.",
    "installation_identity_owner": "A separate controlled installation receipt and fresh-process validation establish installed runtime identity.",
    "project_decision_owner": "An accountable human and the relevant project record decide project, data, Gate, manuscript, compliance, and submission actions."
  },
  "modules": [
    {
      "module_id": "00",
      "module_name": "manifest and profiles",
      "posture": "active_bounded",
      "bounded_surfaces": [{"surface_id": "public_profile_declaration", "summary": "Declares the standalone and framework_integrated public profiles and their framework contract.", "interface_paths": ["SYSTEM_MANIFEST.yaml", "system/00_manifest_and_profiles/MODULE.md"], "capability_ids": ["GRW-CAP-031-03", "GRW-CAP-130-01"], "profile_scope": "both"}],
      "external_boundaries": [{"boundary_id": "exact_framework_validation", "non_claim": "A familiar workspace tree or untagged checkout does not prove framework-integrated support.", "responsible_authority_type": "separate_controlled_process"}],
      "v1_exclusions": [{"exclusion_id": "private_lab_extended_profile", "non_claim": "Private Lab Extended is not a public profile or service-discovery fallback."}],
      "compatibility_and_migration": {"v012_user_action": "no_action_required", "migration_action": "none", "compatibility_limit": "The matrix adds a support description and does not alter profile behavior."},
      "maintenance_owner": "accountable_maintainer",
      "evidence_references": [{"kind": "module_record", "path": "system/00_manifest_and_profiles/MODULE.md", "identifier": "Manifest And Profiles"}, {"kind": "test", "path": "tests/test_framework_candidate_integration.py", "identifier": "FrameworkCandidateIntegrationTests"}],
      "known_limitations": "Does not prove every framework release, private workspace, or runtime is compatible.",
      "refusal_statement": "Refuse a profile-support claim when the required exact framework evidence or profile declaration is missing or conflicting."
    },
    {
      "module_id": "01",
      "module_name": "governance and authority",
      "posture": "active_bounded",
      "bounded_surfaces": [{"surface_id": "human_governed_routing", "summary": "Routes named task classes and states consequential human stops.", "interface_paths": ["SKILL.md", "references/startup-and-routing.md"], "capability_ids": ["GRW-CAP-031-01"], "profile_scope": "both"}],
      "external_boundaries": [{"boundary_id": "substantive_decisions", "non_claim": "Scientific, ethics, compliance, and publication decisions require accountable-human and task-specific authority.", "responsible_authority_type": "accountable_human"}],
      "v1_exclusions": [{"exclusion_id": "autonomous_authority", "non_claim": "The system does not grant autonomous project, compliance, or publication authority."}],
      "compatibility_and_migration": {"v012_user_action": "no_action_required", "migration_action": "none", "compatibility_limit": "Routing remains an aid and never replaces a named project authority."},
      "maintenance_owner": "accountable_maintainer",
      "evidence_references": [{"kind": "module_record", "path": "system/01_governance_and_authority/MODULE.md", "identifier": "Governance Module Boundary"}, {"kind": "test", "path": "tests/test_system_foundation.py", "identifier": "SystemFoundationTests"}],
      "known_limitations": "A route classification does not establish factual truth, permission, or approval.",
      "refusal_statement": "Refuse to treat routing output as a research, compliance, Gate, Release, or submission decision."
    },
    {
      "module_id": "02",
      "module_name": "project workspace and bootstrap",
      "posture": "active_bounded",
      "bounded_surfaces": [{"surface_id": "controlled_empty_bootstrap", "summary": "Provides an explicitly invoked empty-workspace bootstrap with preview and matching human confirmation.", "interface_paths": ["scripts/bootstrap_empty_workspace.py", "references/controlled-bootstrap.md"], "capability_ids": ["GRW-CAP-031-02", "GRW-CAP-080-03"], "profile_scope": "both"}],
      "external_boundaries": [{"boundary_id": "project_state_and_material", "non_claim": "A bootstrap does not import a project, data, protocol, or research state.", "responsible_authority_type": "project_specific_authority"}],
      "v1_exclusions": [{"exclusion_id": "general_project_writer", "non_claim": "No generic project writer, importer, or state-advancement helper is provided."}],
      "compatibility_and_migration": {"v012_user_action": "no_action_required", "migration_action": "none", "compatibility_limit": "Existing bootstrap preview and confirmation behavior remains unchanged."},
      "maintenance_owner": "accountable_maintainer",
      "evidence_references": [{"kind": "module_record", "path": "system/02_project_workspace_and_bootstrap/MODULE.md", "identifier": "Project Workspace And Bootstrap"}, {"kind": "test", "path": "tests/test_bootstrap_empty_workspace.py", "identifier": "BootstrapEmptyWorkspaceTests"}],
      "known_limitations": "The helper creates only a generic empty scaffold and receipt.",
      "refusal_statement": "Refuse a request to use bootstrap as permission to copy material, overwrite a project, or advance project state."
    },
    {
      "module_id": "03",
      "module_name": "workflows",
      "posture": "active_bounded",
      "bounded_surfaces": [{"surface_id": "bounded_route_guidance", "summary": "Provides route guidance and blank records for named research and manuscript workflow classes.", "interface_paths": ["references/governed-work-and-feasibility.md", "references/manuscript-and-submission-control.md"], "capability_ids": ["GRW-CAP-060-01", "GRW-CAP-110-01"], "profile_scope": "both"}],
      "external_boundaries": [{"boundary_id": "real_study_execution", "non_claim": "A workflow guide does not execute a real study, analysis, manuscript decision, or submission.", "responsible_authority_type": "project_specific_authority"}],
      "v1_exclusions": [{"exclusion_id": "workflow_executor", "non_claim": "No autonomous workflow executor or state-advancement service is provided."}],
      "compatibility_and_migration": {"v012_user_action": "no_action_required", "migration_action": "none", "compatibility_limit": "Existing routes remain bounded guidance and blank records."},
      "maintenance_owner": "accountable_maintainer",
      "evidence_references": [{"kind": "module_record", "path": "system/03_workflows/MODULE.md", "identifier": "Workflows Module Boundary"}, {"kind": "test", "path": "tests/test_v0_11_manuscript_governance_and_experience.py", "identifier": "V011ManuscriptGovernanceAndExperienceTests"}],
      "known_limitations": "Workflow records can be structurally valid while real project facts remain unknown.",
      "refusal_statement": "Refuse to present a route or blank record as proof that a study, manuscript, Gate, or submission is approved."
    },
    {
      "module_id": "04",
      "module_name": "evidence, requirements, and knowledge",
      "posture": "active_bounded",
      "bounded_surfaces": [{"surface_id": "evidence_and_citation_guidance", "summary": "Provides generic evidence, citation, and current-requirement guidance without bundled sources.", "interface_paths": ["references/evidence-and-citation-control.md", "system/04_evidence_requirements_and_knowledge/MODULE.md"], "capability_ids": ["GRW-CAP-060-01", "GRW-CAP-110-06"], "profile_scope": "both"}],
      "external_boundaries": [{"boundary_id": "current_external_requirements", "non_claim": "Current sources, journal rules, and external requirements must be obtained and assessed for the actual task.", "responsible_authority_type": "external_current_source"}],
      "v1_exclusions": [{"exclusion_id": "knowledge_service", "non_claim": "No source corpus, retrieval service, RAG system, or current-requirement determiner is provided."}],
      "compatibility_and_migration": {"v012_user_action": "no_action_required", "migration_action": "none", "compatibility_limit": "The package continues to provide guidance rather than source content or access."},
      "maintenance_owner": "accountable_maintainer",
      "evidence_references": [{"kind": "module_record", "path": "system/04_evidence_requirements_and_knowledge/MODULE.md", "identifier": "Knowledge Module Boundary"}, {"kind": "test", "path": "tests/test_v0_11_manuscript_governance_and_experience.py", "identifier": "V011ManuscriptGovernanceAndExperienceTests"}],
      "known_limitations": "It cannot establish that a source is current, supports a claim, or may be redistributed.",
      "refusal_statement": "Refuse a source-support, currentness, or retrieval claim without a separately reviewed current external source."
    },
    {
      "module_id": "05",
      "module_name": "data and provenance",
      "posture": "active_bounded",